{
  "kind": "aurora.payload",
  "schemaVersion": { "major": 1, "minor": 0, "lifecycle": "preview" },
  "projectId": "01890f3e-4c7b-7cc2-98c4-dc0c0c073990",
  "productVersion": "0.1.0",
  "targetProfileDigest": "sha256:2222222222222222222222222222222222222222222222222222222222222222",
  "artifacts": [],
  "contracts": [{ "name": "aurora.common", "minimum": "1.0", "maximum": "1.0" }],
  "capabilities": ["aurora.io.read@1"],
  "sbomDigest": "sha256:3333333333333333333333333333333333333333333333333333333333333333",
  "toolchainDigest": "sha256:4444444444444444444444444444444444444444444444444444444444444444",
  "buildInputDigest": "sha256:5555555555555555555555555555555555555555555555555555555555555555",
  "extensions": {
    "vendor.example": {
      "size": "large",
      "memoryBytes": "dynamic",
      "minimum": "custom",
      "maximum": "custom",
      "capabilities": ["z", "a"],
      "artifacts": [{ "path": "z" }, { "path": "a" }],
      "contracts": [{ "name": "z" }, { "name": "a" }]
    }
  }
}
